{"$schema":"https://json-schema.org/draft/2020-12/schema","$id":"https://business-automation-system.local/schemas/wf-01-intake.json","title":"WF-01 Intake Request","type":"object","additionalProperties":false,"required":["request_id","title","requester","description"],"properties":{"request_id":{"type":"string","minLength":1,"maxLength":128},"title":{"type":"string","minLength":1,"maxLength":200},"requester":{"type":"string","minLength":1,"maxLength":200},"description":{"type":"string","minLength":1,"maxLength":10000},"source":{"enum":["manual","api","webhook","n8n"]},"priority":{"enum":["P1","P2","P3","P4"]},"repository":{"type":"string","maxLength":300},"acceptance_criteria":{"type":"array","items":{"type":"string","minLength":1,"maxLength":2000}},"constraints":{"type":"array","items":{"type":"string","minLength":1,"maxLength":2000}}}}