{"request_id":"REQ-0001","title":"Add customer export API","requester":"user-001","description":"Provide an authenticated export endpoint for customer records.","source":"api","priority":"P2","repository":"Muchlis99/business-automation-system","acceptance_criteria":["Endpoint requires authorization.","Export is covered by automated tests."],"constraints":["No production data mutation."]}